restaurant name,restaurant type,cuisines type,rate (out of 5),avg cost (two people),area,city
AB's - Absolute Barbecues,Restaurant,"Continental, North Indian, Chinese",4.9,1400.0,Hinjawadi,Pune
Cafe Co2 Resto Lounge,Restaurant,"North Indian, Chinese, Continental, Kebab, Seafood",4.6,1500.0,Bhugaon,Pune
Paasha - JW Marriott Pune,Restaurant,"North Indian, Kebab, Biryani",4.6,2500.0,Senapati Bapat Road,Pune
I Amsterdam,Restaurant,"Asian, European, Modern Indian, Italian",4.3,1400.0,Hinjawadi,Pune
FC Road Social,Restaurant,"North Indian, Chinese, Biryani, American, Continental",4.5,1500.0,Shivaji Nagar,Pune
Flechazo,Restaurant,"Asian, Mediterranean, North Indian",4.6,1400.0,Wakad,Pune
Barbeque Nation - Sayaji Hotel,Restaurant,"North Indian, Mughlai, Salad, Kebab, BBQ",4.5,1700.0,Wakad,Pune
BeHive,Restaurant,"North Indian, Chinese, Continental",4.0,1400.0,Hinjawadi,Pune
Kayani Bakery,Restaurant,Bakery,4.7,150.0,East Street,Pune
Exotica,Restaurant,"North Indian, Chinese, Mediterranean, Continental",4.2,1400.0,Yerawada,Pune
Planet 9,Restaurant,"North Indian, Mughlai, Biryani",4.6,1500.0,Bavdhan,Pune
Toit,Restaurant,"Modern Indian, American, Italian",4.6,1500.0,Kalyani Nagar,Pune
Smoky Beach,Restaurant,"Chinese, Continental, North Indian, Italian",4.2,1300.0,Bhugaon,Pune
Barbeque Ville,Restaurant,"North Indian, BBQ",4.4,1000.0,Wakad,Pune
Thorat's Baarbeque Misal,Restaurant,Street Food,4.0,250.0,Narhe,Pune
2BHK Diner & Key Club,Restaurant,"North Indian, Mediterranean, European, Finger Food",4.2,1800.0,Bund Garden Road,Pune
The Mafia,Restaurant,"North Indian, Continental, Asian, Italian",4.1,1500.0,Viman Nagar,Pune
The Cult - Terra,Restaurant,"North Indian, Continental, Lebanese, Italian, Seafood, Asian",4.4,1700.0,Magarpatta,Pune
Le Plaisir,Restaurant,"European, Italian, Continental",4.7,1000.0,Deccan Gymkhana,Pune
Teritree,Restaurant,"North Indian, Chinese, Continental",3.7,1600.0,Hadapsar,Pune
Sukanta,Restaurant,"Gujarati, North Indian, Maharashtrian",4.1,700.0,Deccan Gymkhana,Pune
Tarsh Gastronomia,Restaurant,"North Indian, Italian, Asian, Mediterranean, Continental, European, Kebab, BBQ",4.4,1500.0,Hinjawadi,Pune
TTF - The Tenth Floor,Restaurant,"North Indian, Continental, Finger Food",4.4,1500.0,Baner,Pune
The Barkhana,Restaurant,"North Indian, Continental, Chinese",4.7,1700.0,Wakad,Pune
Publiq,Restaurant,"Bar Food, Asian, North Indian, Italian",4.0,1600.0,Hinjawadi,Pune
Atmosphere 6,Restaurant,"North Indian, Continental, Chinese, Italian, Salad",4.0,1700.0,Viman Nagar,Pune
Aroma's Hyderabad House,Restaurant,"Biryani, North Indian, Mughlai, Chinese",4.1,900.0,Viman Nagar,Pune
The Ruby Hilltop - Sunny's World,Restaurant,"North Indian, Chinese, Italian, Continental",4.4,1300.0,Sus,Pune
The FML Lounge,Restaurant,"North Indian, Mughlai, Chinese",4.3,1500.0,Hinjawadi,Pune
Mi-a-Mi - JW Marriott Pune,Restaurant,Finger Food,4.3,2500.0,Senapati Bapat Road,Pune
Spice Factory,Restaurant,"North Indian, Italian, Chinese",4.0,2000.0,Hinjawadi,Pune
Hotel Jagdamba,Restaurant,"Maharashtrian, North Indian",4.4,600.0,Shivapur,Pune
The Urban Foundry,Restaurant,"Bar Food, North Indian, Asian, Fast Food",4.5,1500.0,Baner,Pune
The Secret Garden,Restaurant,"North Indian, Continental, Italian",0.0,1400.0,Mundhwa,Pune
Universal Barbeque,Restaurant,"BBQ, North Indian, Chinese",4.5,1200.0,Hinjawadi,Pune
Smoke On The Water,Restaurant,"North Indian, Continental, Asian, Mughlai, Chinese",4.0,1300.0,Bhugaon,Pune
Surve's Pure Non-Veg,Restaurant,Maharashtrian,4.2,550.0,FC Road,Pune
Urbo,Restaurant,"Italian, Continental, Chinese, Asian, North Indian",4.1,1700.0,Baner,Pune
Spice Kitchen - JW Marriott Pune,Restaurant,"Italian, Asian, North Indian, South Indian, European",4.4,2200.0,Senapati Bapat Road,Pune
Barometer,Restaurant,"Continental, Asian, Italian, North Indian, Finger Food, Fast Food",4.5,1500.0,Kothrud,Pune
Cafe Goodluck,Restaurant,"North Indian, Mughlai, Malwani, Fast Food, Street Food",4.2,600.0,Deccan Gymkhana,Pune
German Bakery,Restaurant,"German, Italian, Cafe",4.2,1100.0,Koregaon Park,Pune
Pimlico,Restaurant,"Cafe, Continental, Italian",4.2,700.0,Koregaon Park,Pune
Babylon Craft Brewery,Restaurant,"North Indian, Chinese, Continental, Mughlai, Asian, Italian, Beverages",4.9,900.0,Erandwane,Pune
Darshan,Restaurant,"Italian, Continental, Chinese, Mexican, Fast Food, Street Food, Desserts",4.8,700.0,Baner,Pune
Eternia Rooftop,Restaurant,"American, Chinese, North Indian, Italian, Mughlai",4.6,1800.0,Senapati Bapat Road,Pune
Blu Grass,Restaurant,"North Indian, Continental, Italian",4.1,1300.0,Hinjawadi,Pune
The Sassy Spoon,Restaurant,"European, Asian, Italian, Finger Food, Salad, Fast Food",4.6,1500.0,Koregaon Park,Pune
Vaishali,Restaurant,"South Indian, Street Food, Fast Food",4.4,500.0,FC Road,Pune
Tatva The Vegetarian Kitchen,Restaurant,"North Indian, Chinese, Continental, South Indian, Fast Food, Street Food, Beverages",4.3,850.0,Wakad,Pune
Marz-O-Rin,Restaurant,"Fast Food, Desserts, Beverages",4.1,300.0,MG Road,Pune
PK Biryani House,Restaurant,"Biryani, North Indian, Seafood",3.9,700.0,Karve Nagar,Pune
Zeeshan Restaurant - Apna Hyderabadi Food,Restaurant,"North Indian, Chinese, Biryani, Kebab, Arabian, Malwani",4.3,700.0,Viman Nagar,Pune
Durvankur,Restaurant,Maharashtrian,4.2,600.0,Sadashiv Peth,Pune
Agent Jack's,Restaurant,"Finger Food, Continental, North Indian, Italian, Asian, Desserts",4.3,1500.0,Baner,Pune
ROOTS 9 KITCHEN & BAR,Restaurant,"Continental, Italian, North Indian, Finger Food",4.4,1400.0,Erandwane,Pune
Penthouze,Restaurant,"Finger Food, Italian, Pizza",3.9,2200.0,Mundhwa,Pune
Little Italy,Restaurant,"Italian, Mexican, Salad, Juices",4.4,2100.0,Shivaji Nagar,Pune
World of Veg,Restaurant,"North Indian, Chinese, Italian",3.9,1500.0,Shivaji Nagar,Pune
Linkin Barrel,Restaurant,"Continental, Modern Indian, Italian, North Indian",4.3,1300.0,Baner,Pune
Fly High,Restaurant,"Continental, Italian, Chinese, North Indian",4.3,2000.0,Hinjawadi,Pune
Thikana,Restaurant,"Bar Food, North Indian, Fast Food",4.0,1500.0,Hinjawadi,Pune
High Spirits,Restaurant,"Finger Food, Continental, Italian, North Indian, Mexican",4.2,1500.0,Mundhwa,Pune
Cuba Libre,Restaurant,"Finger Food, Continental, Italian, North Indian",4.4,2200.0,Wakad,Pune
Dario's,Restaurant,"Italian, Pizza, Salad, Healthy Food, Mexican, Cafe, Desserts, Continental",4.4,1600.0,Koregaon Park,Pune
Burger,Restaurant,"Burger, Fast Food",4.6,250.0,East Street,Pune
NH 37 Dhaba,Restaurant,"Chinese, North Indian, Bengali, Salad",4.1,1200.0,Pune University,Pune
Hippie@Heart,Restaurant,"Continental, Italian, North Indian, Finger Food, European",4.5,1300.0,Deccan Gymkhana,Pune
Kargo,Restaurant,"Asian, Continental, North Indian, Italian",4.5,1100.0,Koregaon Park,Pune
Theobroma,Restaurant,"Bakery, Desserts, Fast Food",4.5,600.0,Koregaon Park,Pune
Malaka Spice,Restaurant,"Malaysian, Thai, Vietnamese, Japanese, Korean, Asian, Salad",4.4,1800.0,Koregaon Park,Pune
360 Degree - The Revolving Fine Dine Restaurant,Restaurant,"North Indian, Continental, Asian, Mughlai",4.2,1200.0,JM Road,Pune
Vohuman Cafe,Restaurant,Street Food,4.7,250.0,Dhole Patil Road,Pune
Maharaja Bhog,Restaurant,"North Indian, Gujarati, Rajasthani",4.6,1000.0,Senapati Bapat Road,Pune
Hard Rock Cafe,Restaurant,"American, Continental, Mexican, Salad",4.5,2500.0,Mundhwa,Pune
Blue Nile,Restaurant,"Chinese, North Indian, Mughlai",3.9,800.0,Camp Area,Pune
Ministry Of Barbeque,Restaurant,"North Indian, Continental",4.2,1000.0,Wakad,Pune
Yana Sizzlers & Wok,Restaurant,"Chinese, Continental, Seafood, Salad",4.3,1000.0,FC Road,Pune
Autobahn,Restaurant,"Bengali, Chettinad, Goan, North Indian",4.7,1300.0,Viman Nagar,Pune
18 Degrees Resto Lounge,Restaurant,"North Indian, Mediterranean, Chinese",3.6,2100.0,Pimple Saudagar,Pune
Satguru's Punjabi Rasoi,Restaurant,"North Indian, Mughlai, Fast Food",4.2,1200.0,Magarpatta,Pune
Anna Idli,Restaurant,"South Indian, Fast Food",4.4,400.0,Baner,Pune
Crazy Cheesy,Restaurant,"Cafe, Fast Food, Pizza, Sandwich",4.4,450.0,Sadashiv Peth,Pune
Azzurro,Restaurant,"Continental, Asian, North Indian, Mughlai",4.0,1600.0,Baner,Pune
Gong,Restaurant,"Asian, Thai, Sushi",4.7,1700.0,Baner,Pune
The Deccan Bid Capital,Restaurant,"Asian, Continental, North Indian",4.7,1200.0,Shivaji Nagar,Pune
Claypot,Restaurant,"North Indian, Seafood, Chinese",3.9,700.0,Kharadi,Pune
Le Stone,Restaurant,"North Indian, Continental, Kebab, Pizza, Chinese",4.5,1500.0,Ravet,Pune
Zeleb,Restaurant,Bar Food,3.4,1300.0,Mundhwa,Pune
Marine Drive,Restaurant,"Continental, North Indian, Italian, Asian",3.9,1500.0,Hinjawadi,Pune
Legends of Punjab,Restaurant,"North Indian, Italian, Continental, Mexican",0.0,1500.0,Kalyani Nagar,Pune
Pop Tate's,Restaurant,"Continental, Italian, Chinese",4.9,1400.0,Viman Nagar,Pune
Highland,Restaurant,"Bar Food, North Indian, Mughlai, Chinese",4.1,1200.0,Baner,Pune
P. K. Biryani House,Restaurant,"Biryani, Seafood, North Indian, Kebab",3.9,1100.0,Kothrud,Pune
Lad Restaurant,Restaurant,"Maharashtrian, North Indian",4.2,500.0,Wakad,Pune
Texas Tower,Restaurant,"Continental, North Indian, Italian, Finger Food, Desserts",4.0,1600.0,Kharadi,Pune
Elephant & Co.,Restaurant,"Finger Food, Continental, Salad",4.3,1500.0,Kalyani Nagar,Pune
Effingut Brewerkz,Restaurant,"Continental, North Indian, Mughlai, Italian, Asian",4.5,2000.0,Baner,Pune
Cafe Paashh,Restaurant,"Cafe, European, Healthy Food, Modern Indian",4.9,1500.0,Kalyani Nagar,Pune
The Ritz-Carlton Tea Lounge,Restaurant,"Cafe, Tea, Bakery, Desserts, Beverages",0.0,1800.0,Yerawada,Pune
Madéline,Restaurant,"Cafe, French, European",3.9,850.0,Kothrud,Pune
Baobab,Restaurant,"North Indian, Italian, Asian",4.8,1200.0,Bund Garden Road,Pune
Moshi Moshi,Restaurant,"Malaysian, Thai, Vietnamese, Japanese, Korean, Asian, Sushi, Salad",4.6,1500.0,Koregaon Park,Pune
Loft,Restaurant,"Cafe, Continental, Italian, Thai, North Indian, Pizza, Burger",4.5,700.0,Viman Nagar,Pune
Culture - पुणे,Restaurant,"Bar Food, North Indian, Italian, Continental",4.3,1300.0,FC Road,Pune
McDonald's,Restaurant,"Burger, Fast Food",3.7,500.0,Aundh,Pune
Independence Brewing Company,Restaurant,"American, Continental, Mexican, North Indian, Beverages",4.3,1800.0,Mundhwa,Pune
Tatyancha Dhaba,Restaurant,"North Indian, Chinese",3.6,650.0,Baner,Pune
Cafe Blu - Radisson Blu,Restaurant,"Continental, North Indian, Asian, Fast Food, Beverages",4.6,1500.0,Hinjawadi,Pune
Green Signal,Restaurant,"Chinese, North Indian, Continental, Beverages",4.0,700.0,Deccan Gymkhana,Pune
SP's Biryani House,Restaurant,"Biryani, Mughlai",3.9,650.0,Sadashiv Peth,Pune
Baba Ramdev Dhaba,Restaurant,"North Indian, Rajasthani",4.2,400.0,Nigdi,Pune
Retox,Restaurant,"Asian, North Indian, European, Continental, Finger Food",4.4,2000.0,Erandwane,Pune
Baraza Bars & Bites,Restaurant,"Modern Indian, North Indian, Asian, Continental, Mughlai, Bar Food",4.5,1500.0,Yerawada,Pune
BarBerry,Restaurant,"North Indian, Italian, Finger Food",4.8,1200.0,Kothrud,Pune
Nawab Asia,Restaurant,"North Indian, Chinese, Mughlai, Biryani, Desserts, Beverages",4.0,1300.0,Baner,Pune
Blue Water,Restaurant,"North Indian, Chinese, Continental",4.6,1800.0,Ravet,Pune
True Tramm Trunk,Restaurant,"North Indian, Fast Food, Asian",4.4,1600.0,Aundh,Pune
Tathya,Restaurant,"North Indian, Mughlai, Biryani",4.6,1300.0,Bund Garden Road,Pune
Santè Spa Cuisine,Restaurant,"Salad, Continental, Healthy Food, Mediterranean, Pizza",4.8,1300.0,Koregaon Park,Pune
UNWIND,Restaurant,"North Indian, European, Asian, Kebab, Afghan, Continental",4.1,2200.0,Mundhwa,Pune
The Irani Cafe,Restaurant,"Iranian, Fast Food",4.3,300.0,Viman Nagar,Pune
Arabian Bites,Restaurant,Arabian,4.3,250.0,Kondhwa,Pune
Makaza,Restaurant,"North Indian, Chinese",4.2,1200.0,Viman Nagar,Pune
Chili's American Grill & Bar,Restaurant,"Mexican, American, Tex-Mex, Salad, Burger",4.9,1400.0,Viman Nagar,Pune
Madari - The Crazy Bar,Restaurant,"Finger Food, Modern Indian, Italian, Bar Food",4.0,1400.0,Baner,Pune
Sigree,Restaurant,North Indian,4.1,1600.0,Aundh,Pune
The Cult - House,Restaurant,"Modern Indian, Continental, Sushi, Finger Food, Asian, Bar Food",3.6,2000.0,Magarpatta,Pune
Mezza 9,Restaurant,"Continental, North Indian, Mughlai, Asian",3.9,1700.0,Hinjawadi,Pune
Tales & Spirits,Restaurant,"Italian, Continental, Salad, Bar Food",4.3,1500.0,Senapati Bapat Road,Pune
House of Paratha,Restaurant,"North Indian, Chinese",4.1,500.0,JM Road,Pune
Mughal Mahal,Restaurant,"North Indian, Mughlai, Biryani, Chinese",4.4,1500.0,Hinjawadi,Pune
Hackers Kitchen & Bar,Restaurant,"North Indian, Continental, Chinese, Seafood",4.2,2200.0,Kharadi,Pune
The Millers Homebar & Kitchen,Restaurant,"Continental, North Indian, Thai",4.4,1300.0,Bund Garden Road,Pune
Level 5 Bistro and Bar,Restaurant,"European, Italian, American",4.8,1200.0,Erandwane,Pune
Tipsy Turtle,Restaurant,"North Indian, Seafood, Italian",3.8,800.0,Bavdhan,Pune
RushHrs,Restaurant,"Fast Food, Burger, Rolls",4.0,500.0,Magarpatta,Pune
Samudra,Restaurant,"South Indian, Fast Food, North Indian, Chinese, Beverages",4.2,850.0,Erandwane,Pune
Son Of A Gun,Restaurant,"Italian, Mexican, North Indian, Bar Food",4.1,1300.0,Baner,Pune
Kerala Cafe,Restaurant,"Kerala, South Indian, Seafood",4.4,700.0,Kalyani Nagar,Pune
Nisarg,Restaurant,"Malwani, North Indian, Seafood",4.2,1300.0,Erandwane,Pune
Sky High - The Club,Restaurant,"North Indian, Chinese, Continental, Thai",3.7,1600.0,Kharadi,Pune
Grandmama's Cafe,Restaurant,"Continental, Desserts, Fast Food",4.2,1200.0,Koregaon Park,Pune
Laa Unico,Restaurant,"Italian, Mexican, Continental, Modern Indian, Beverages",4.6,1500.0,Swargate,Pune
Burger King,Restaurant,"Burger, Fast Food, Beverages",3.9,500.0,FC Road,Pune
Green Park,Restaurant,"North Indian, Chinese, Continental, Thai, Mexican, Seafood, Kebab, Mangalorean",3.9,1500.0,Baner,Pune
Talli,Restaurant,"North Indian, Asian, Continental, Italian",4.3,1200.0,Koregaon Park,Pune
FOMO,Restaurant,"Continental, Fast Food, North Indian",4.2,1250.0,Hinjawadi,Pune
Carnival Restaurant and Bar,Restaurant,"North Indian, Chinese, Continental, Seafood, Salad",4.0,1800.0,Mundhwa,Pune
Mainland China,Restaurant,"Chinese, Asian, Sushi, Momos, Japanese, Thai",4.4,1800.0,Senapati Bapat Road,Pune
Ahilyadevi's Thali,Restaurant,Maharashtrian,4.5,1200.0,Katraj,Pune
The French Window Patisserie,Restaurant,"Cafe, Desserts, French, Bakery, European",4.6,600.0,Koregaon Park,Pune
BMG - Unplugged,Restaurant,"Continental, North Indian, Italian, Chinese",4.3,1500.0,Hadapsar,Pune
Yeti and the Monk,Restaurant,"Tibetan, Vietnamese",4.4,500.0,Khadki,Pune
Hotel Shreyas,Restaurant,"Maharashtrian, Fast Food, Beverages",4.0,500.0,Deccan Gymkhana,Pune
Rubabdaar,Restaurant,"North Indian, Mughlai, Chinese",4.4,1400.0,Baner,Pune
Hakuna Matata,Restaurant,"North Indian, Chinese, Mexican, Italian",4.2,1600.0,JM Road,Pune
Reddy's Restaurant,Restaurant,"North Indian, Chinese, Mughlai",4.0,700.0,Karve Nagar,Pune
Guru Sawants's Malwan Katta,Restaurant,Malwani,4.3,500.0,Karve Nagar,Pune
Tawa Street,Restaurant,"North Indian, Fast Food",4.0,600.0,Viman Nagar,Pune
Village - The Soul of India,Restaurant,"North Indian, Lucknowi, Gujarati, Maharashtrian, South Indian, Bengali",3.9,1000.0,Hadapsar,Pune
Jashn,Restaurant,"North Indian, Mughlai, American, Italian, Asian",4.1,950.0,Salunkhe Vihar Road,Pune
Apache High Street,Restaurant,"Finger Food, Continental, Salad",4.3,1100.0,Baner,Pune
Farmaaish Lounge & Bar,Restaurant,"Continental, Asian, North Indian, European",4.0,1200.0,Viman Nagar,Pune
Fish Curry Rice,Restaurant,"Seafood, Goan, Malwani, Maharashtrian",4.4,1200.0,Law College Road,Pune
Krave - Kitchen & Bar,Restaurant,"North Indian, Continental, European",4.0,1500.0,Pimple Nilakh,Pune
Pide Turkish Cafe,Restaurant,"Turkish, Beverages",4.2,500.0,FC Road,Pune
Rajdhani,Restaurant,"Rajasthani, Gujarati, North Indian",3.8,800.0,Viman Nagar,Pune
Raju Uncle's Chole Bhature,Restaurant,North Indian,4.2,200.0,Katraj,Pune
Bacharika- Rooftop Bar And Kitchen,Restaurant,"Chinese, North Indian, Continental, Middle Eastern, European",0.0,1000.0,Kothrud,Pune
Sujata Mastani,Restaurant,"Ice Cream, Beverages",4.4,200.0,Sadashiv Peth,Pune
Italy Via Punjab,Restaurant,"Italian, North Indian",4.1,800.0,Baner,Pune
TNG - The Natty & Groovy,Restaurant,"Continental, Chinese, Finger Food, North Indian, Beverages",0.0,1400.0,Koregaon Park,Pune
Portico - Sayaji Hotel,Restaurant,"North Indian, Asian, European, Salad",4.4,1400.0,Wakad,Pune
360 Degree - The Lounge,Restaurant,"North Indian, Continental, Asian, Mughlai",3.6,1400.0,JM Road,Pune
Desi Dhaba,Restaurant,North Indian,4.2,300.0,Hinjawadi,Pune
The K Factory,Restaurant,"Continental, Italian, North Indian, Desserts, Salad, Charcoal Chicken, Biryani, Beverages",4.3,2000.0,Baner,Pune
Playboy Beer Garden,Restaurant,"American, Chinese, North Indian",3.8,1800.0,Koregaon Park,Pune
Turque - Sayaji Hotel,Restaurant,"Asian, Mughlai, North Indian, Salad",4.5,1700.0,Wakad,Pune
Murphies,Restaurant,"Salad, European, Steak, Healthy Food, Beverages, Finger Food, Continental",4.2,1300.0,Koregaon Park,Pune
Onesta,Restaurant,"Pizza, Italian, Fast Food, Desserts",4.7,700.0,Hadapsar,Pune
Cafe Kathaa,Restaurant,"Cafe, Continental, Beverages",4.2,700.0,FC Road,Pune
Rangla Punjab,Restaurant,"North Indian, Lucknowi, Beverages",3.8,800.0,Pashan,Pune
Abhishek Veg Restaurant,Restaurant,"South Indian, North Indian, Street Food, Fast Food, Chinese",4.0,600.0,Erandwane,Pune
Sentosa MultiCuisine Restaurant,Restaurant,"North Indian, Chinese, Mughlai, Continental",4.6,1400.0,Ravet,Pune
Dhaba Estd 1986 Delhi,Restaurant,North Indian,4.4,1800.0,Senapati Bapat Road,Pune
Mapro Garden,Restaurant,"Desserts, Fast Food, Pizza, Sandwich",4.4,800.0,Lonavala,Pune
Frozen Monkey,Restaurant,"Continental, Italian, North Indian, Finger Food, Asian",4.5,1300.0,Hinjawadi,Pune
Coriander Kitchen - Conrad Pune,Restaurant,"North Indian, Asian, Mediterranean",4.3,3200.0,Bund Garden Road,Pune
Backstage,Restaurant,"North Indian, Chinese, Continental",3.9,1250.0,Viman Nagar,Pune
Huber & Holly,Restaurant,"Ice Cream, Desserts, Fast Food, Pizza",4.7,1000.0,Koregaon Park,Pune
Vice Versa,Restaurant,"Cafe, Italian, Continental, Desserts",4.4,950.0,Shivaji Nagar,Pune
The Daily All Day,Restaurant,"European, Asian, Continental, Italian",4.4,2000.0,Koregaon Park,Pune
Mocha,Restaurant,"Cafe, Continental, European, Salad, Asian",4.4,1000.0,Koregaon Park,Pune
Starbucks Coffee,Restaurant,"Cafe, Coffee, Tea, Desserts",4.4,700.0,FC Road,Pune
Pakwan - The Food Tradition,Restaurant,"North Indian, Rajasthani, Gujarati",4.2,500.0,Pimple Saudagar,Pune
Beto's,Restaurant,"North Indian, Continental, Italian, Chinese, Seafood",4.4,2100.0,NIBM Road,Pune
Tiranga Bhuvan Kothrud,Restaurant,"Maharashtrian, North Indian, Biryani",4.0,800.0,Kothrud,Pune
Thalasso,Restaurant,"Maharashtrian, Bar Food",0.0,1000.0,Bhugaon,Pune
Pune Baking Company - JW Marriott Pune,Restaurant,"Desserts, Cafe, Bakery",4.5,700.0,Senapati Bapat Road,Pune
Pizza Hut,Restaurant,"Pizza, Italian, Fast Food",2.9,600.0,Viman Nagar,Pune
CAFE PETER,Restaurant,"Cafe, Desserts, Fast Food",4.0,900.0,Shivaji Nagar,Pune
Karolbaug The Dhaba,Restaurant,"North Indian, Mughlai, Chinese",3.9,900.0,Hinjawadi,Pune
The Kinara Village Dhaba,Restaurant,"North Indian, Fast Food, Chinese, Mughlai, Beverages",3.9,1200.0,Lonavala,Pune
1000 Oaks,Restaurant,"North Indian, Mughlai, Salad",4.1,2200.0,East Street,Pune
Botanica The Green House Bar,Restaurant,"Asian, North Indian, Finger Food, Italian",4.1,1400.0,Bund Garden Road,Pune
Savya Rasa,Restaurant,"South Indian, Mangalorean, Kerala, Chettinad",4.6,2100.0,Koregaon Park,Pune
Shriniwas Veg,Restaurant,"North Indian, South Indian, Fast Food, Chinese",4.0,1000.0,Viman Nagar,Pune
The Burger Barn Cafe,Restaurant,"Burger, Fast Food",3.9,800.0,Shivaji Nagar,Pune
Shahi Bhoj Thali Restaurant,Restaurant,"North Indian, Maharashtrian, Rajasthani",4.5,500.0,Shivaji Nagar,Pune
Shahi Bhoj Thali Restaurant,Restaurant,"North Indian, Maharashtrian, Rajasthani",4.5,500.0,Shivaji Nagar,Pune
Pub Le City,Restaurant,"Italian, North Indian, Chinese",4.5,1800.0,Hadapsar,Pune
The Tasty Tiffin,Restaurant,"North Indian, Chinese, Biryani",4.0,400.0,Baner,Pune
Copa Cabana,Restaurant,"Chinese, Continental, Salad, Mexican, Italian, North Indian, Desserts",4.1,1600.0,Pimple Nilakh,Pune
द Vege टेबल,Restaurant,"North Indian, Continental, Italian",4.1,1000.0,FC Road,Pune
Pink Turbann,Restaurant,"North Indian, Fast Food",4.1,350.0,Aundh,Pune
Falahaar,Restaurant,"Fast Food, Street Food, Beverages, Juices",4.3,600.0,Baner,Pune
Parsi Dhaba,Restaurant,"Parsi, North Indian",4.5,1600.0,Lonavala,Pune
Vernekar's Goan Fish Curry,Restaurant,Goan,4.2,400.0,Karve Nagar,Pune
Lager Street - Lounge and Bar,Restaurant,"Bar Food, Continental, Italian, North Indian",4.0,1500.0,Balewadi,Pune
Mineority By Saby,Restaurant,"North Indian, North Eastern, Continental, Asian",4.2,1000.0,Kalyani Nagar,Pune
George Restaurant,Restaurant,"North Indian, Chinese, Biryani",4.0,800.0,East Street,Pune
Citrus Cafe - Lemon Tree Hotel,Restaurant,"North Indian, South Indian, Italian, Asian, Continental",4.2,1600.0,Hinjawadi,Pune
Over The Top - Radisson Blu,Restaurant,"Continental, North Indian, Asian, Bar Food",4.5,1600.0,Hinjawadi,Pune
Chini Chor,Restaurant,"Mithai, Street Food, South Indian",3.8,250.0,Kharadi,Pune
Fish On Dish,Restaurant,Mangalorean,3.7,500.0,Wakad,Pune
Flute,Restaurant,"Chinese, Continental, North Indian",4.0,700.0,Wakad,Pune
Raaga Imperio,Restaurant,"North Indian, Chinese, Continental, Seafood, Desserts",4.2,1700.0,Dange Chowk,Pune
Hoppipola,Restaurant,"Finger Food, Italian, Chinese, Modern Indian",4.5,1600.0,Kalyani Nagar,Pune
Chianti,Restaurant,"Italian, Pizza",4.7,1400.0,Viman Nagar,Pune
Ram Krishna,Restaurant,"Chinese, South Indian, Fast Food, North Indian",4.3,900.0,Camp Area,Pune
Shisha Jazz Cafe,Restaurant,"Iranian, North Indian, Continental",4.1,2000.0,Mundhwa,Pune
UFO Fries & Corn,Restaurant,Fast Food,4.2,700.0,Wakad,Pune
Garden Vada Pav Centre,Restaurant,Street Food,4.3,100.0,Camp Area,Pune
Masaledar Biryani House,Restaurant,"Biryani, Maharashtrian",3.7,200.0,Sadashiv Peth,Pune
Zinq- The Club Lounge,Restaurant,"European, North Indian, Chinese, Bar Food",0.0,1700.0,Magarpatta,Pune
The Chocolate Room,Restaurant,"Cafe, Bakery, Fast Food",3.9,700.0,Viman Nagar,Pune
YOLO Gastro Lounge,Restaurant,"North Indian, Continental, Pizza, Finger Food, Bar Food, European",3.8,1600.0,Pimple Saudagar,Pune
Upsouth,Restaurant,South Indian,4.4,400.0,Aundh,Pune
Latitude - Blue Diamond,Restaurant,"North Indian, Mediterranean, Italian, European, South Indian, Salad",4.2,2000.0,Koregaon Park,Pune
Hotel Sangrilla,Restaurant,"North Indian, Chinese, Seafood",4.4,550.0,Ravet,Pune
Zeta - Hyatt Regency Pune,Restaurant,"European, Continental, Healthy Food, Italian, Salad, Beverages",4.9,2000.0,Viman Nagar,Pune
Cold Stone Creamery,Restaurant,"Bakery, Desserts",4.2,400.0,Viman Nagar,Pune
The Fish Thali,Restaurant,"Maharashtrian, Seafood",4.2,350.0,Shivaji Nagar,Pune
Cream Craver,Restaurant,"North Indian, Chinese, Beverages",4.2,650.0,Camp Area,Pune
Natural Ice Cream,Restaurant,"Ice Cream, Desserts",4.4,150.0,Kothrud,Pune
D Palace,Restaurant,"North Indian, Chinese, Seafood, Mughlai",4.0,1200.0,Bavdhan,Pune
New Sarovar,Restaurant,"North Indian, Chinese",3.7,800.0,Bhugaon,Pune
Maratha Samrat,Restaurant,Maharashtrian,4.2,1100.0,Baner,Pune
Drinx Exchange,Restaurant,"Italian, Mexican, Chinese, North Indian, Desserts",3.9,1300.0,Kharadi,Pune
Pune Bowl Company,Restaurant,"North Indian, Chinese",3.8,350.0,Pimple Nilakh,Pune
Cake N Cafe,Restaurant,"Bakery, North Indian",3.5,200.0,Hadapsar,Pune
Shakahari - JW Marriott Pune,Restaurant,"Rajasthani, Gujarati, North Indian",4.2,2500.0,Senapati Bapat Road,Pune
7th Heaven Cake Shop,Restaurant,"Bakery, Desserts",4.3,600.0,Kothrud,Pune
Swig,Restaurant,"Finger Food, Continental, Italian",4.0,1700.0,Baner,Pune
Paprikaa,Restaurant,"North Indian, Chinese",3.9,800.0,Karve Nagar,Pune
Cafe Farmaish,Restaurant,"Fast Food, North Indian",0.0,350.0,NIBM Road,Pune
Pergola Kitchen And Bar,Restaurant,"Continental, North Indian, Cafe",4.0,1200.0,Kalyani Nagar,Pune
The Bar Stock Exchange,Restaurant,"Continental, Chinese, North Indian, Italian",3.8,1900.0,Koregaon Park,Pune
Levit 8,Restaurant,"North Indian, Continental",4.1,1500.0,Aundh,Pune
Arbour Kitchen | Drinks,Restaurant,"European, Continental, Italian, Tea, Coffee",4.2,1400.0,Kalyani Nagar,Pune
Garden Of Edesia,Restaurant,"North Indian, Continental, Italian",4.2,1400.0,Dhole Patil Road,Pune
Shizusan,Restaurant,"Japanese, Sushi, Vietnamese, Thai, Korean, Chinese, Asian",4.5,1600.0,Viman Nagar,Pune
Prem's,Restaurant,"North Indian, Chinese, Continental, Salad",4.2,1300.0,Koregaon Park,Pune
Ya Basa-The Dhaba,Restaurant,"Seafood, North Indian, Maharashtrian, Chinese, Kebab, Biryani",3.9,700.0,Baner,Pune
Prem's,Restaurant,"North Indian, Chinese, Continental, Salad",4.2,1300.0,Koregaon Park,Pune
The House Of Medici - The Westin,Restaurant,"Asian, Continental",3.9,3000.0,Mundhwa,Pune
Lollapalooza,Restaurant,"North Indian, Continental",4.1,1500.0,Pimple Saudagar,Pune
Between Breads,Restaurant,"Fast Food, Continental",4.4,500.0,Koregaon Park,Pune
Lassi Wassi,Restaurant,"Cafe, Fast Food",4.2,150.0,Kothrud,Pune
Trikaya,Restaurant,"Chinese, Thai, Malaysian, Indonesian, Asian, North Indian",3.9,2000.0,Bavdhan,Pune
Brgrmeister,Restaurant,"Burger, American, BBQ, North Indian",4.0,900.0,Kharadi,Pune
Mamagoto,Restaurant,"Thai, Chinese, Japanese, Momos, Salad, Vietnamese, Malaysian",4.4,2000.0,Senapati Bapat Road,Pune
Tim Luck Luck,Restaurant,"North Indian, Chinese, Seafood",4.3,1000.0,East Street,Pune
Maskawala & Co.,Restaurant,"Parsi, Fast Food, Biryani",0.0,250.0,Kothrud,Pune
Momo's Corrner,Restaurant,"Momos, Tibetan, Beverages",4.5,200.0,Koregaon Park,Pune
Evviva Sky Lounge - Crowne Plaza Pune City Centre,Restaurant,"Bar Food, Kebab, Mexican",4.1,2500.0,Bund Garden Road,Pune
Wadeshwar,Restaurant,"South Indian, Fast Food, Street Food",4.0,600.0,FC Road,Pune
